Id,Title,Tags,Acceptance,Difficulty,Frequency,Link
1,Two Sum,"Array, Hash Table",46.8%,Easy,12.0624,https://leetcode.com/problems/two-sum
2,Add Two Numbers,"Linked List, Math, Recursion",35.8%,Medium,3.23794,https://leetcode.com/problems/add-two-numbers
3,Longest Substring Without Repeating Characters,"Hash Table, Two Pointers, String, Sliding Window",31.6%,Medium,10.9946,https://leetcode.com/problems/longest-substring-without-repeating-characters
33,Search in Rotated Sorted Array,"Array, Binary Search",36.2%,Medium,6.41905,https://leetcode.com/problems/search-in-rotated-sorted-array
48,Rotate Image,Array,61.1%,Medium,5.83535,https://leetcode.com/problems/rotate-image
53,Maximum Subarray,"Array, Divide and Conquer, Dynamic Programming",47.9%,Easy,4.09075,https://leetcode.com/problems/maximum-subarray
73,Set Matrix Zeroes,Array,44.7%,Medium,59.5129,https://leetcode.com/problems/set-matrix-zeroes
91,Decode Ways,"String, Dynamic Programming",27.0%,Medium,11.8086,https://leetcode.com/problems/decode-ways
146,LRU Cache,Design,36.4%,Medium,19.0257,https://leetcode.com/problems/lru-cache
151,Reverse Words in a String,String,24.3%,Medium,15.642,https://leetcode.com/problems/reverse-words-in-a-string
200,Number of Islands,"Depth-first Search, Breadth-first Search, Union Find",49.7%,Medium,5.59139,https://leetcode.com/problems/number-of-islands
234,Palindrome Linked List,"Linked List, Two Pointers",42.2%,Easy,7.14175,https://leetcode.com/problems/palindrome-linked-list
238,Product of Array Except Self,Array,61.4%,Medium,6.81167,https://leetcode.com/problems/product-of-array-except-self
742,Closest Leaf in a Binary Tree,Tree,44.6%,Medium,100.0,https://leetcode.com/problems/closest-leaf-in-a-binary-tree
